{
  "id": "118ynah",
  "timestamp": 1677024000000,
  "category": "academic",
  "concern": "I have ADHD and will be attending a masters this coming fall. But I have unmedicated ADHD (I don’t have insurance and stimulants don’t work for me) and I’m still tryna figure out how to manage my ADHD when it comes to academics. Any tips?",
  "dialogue_total": [
    {
      "index": 0,
      "role": "therapist",
      "statement": "Welcome to our session today! I'm here to listen and support you in any way I can. Feel free to share whatever's on your mind, and we'll take it from there.",
      "phase": "exploring"
    },
    {
      "index": 1,
      "role": "client",
      "statement": "Hey, thanks for having me. I’m just really stressed about starting my master’s program this fall with my unmedicated ADHD, and I’m kinda lost on how to handle it academically.",
      "phase": "exploring"
    },
    {
      "index": "aa",
      "role": "sc_master",
      "statement": "```json\n{\n\"reasoning\": \"The conversation is in the initial stages, with only one turn so far. The client has shared their main concern, but further exploration is needed to fully understand the client's story and context before moving to the Guiding phase.\",\n\"determination\": \"continue\"\n}\n```",
      "phase": "exploring"
    },
    {
      "index": 2,
      "role": "therapist",
      "statement": "That sounds like a lot to juggle, and it’s understandable that you’re feeling stressed. It’s important to remember that you’re not alone in this, and there are resources and strategies available to help you succeed in your master’s program while managing your ADHD. Have you had a chance to explore any of these options yet, or would you like to brainstorm some ideas together?",
      "phase": "exploring"
    },
    {
      "index": 3,
      "role": "client",
      "statement": "Hey, I haven’t really explored much yet, to be honest. I’m just kinda overwhelmed and not sure where to even start with managing this on my own.",
      "phase": "exploring"
    },
    {
      "index": "ab",
      "role": "sc_master",
      "statement": "```json\n{\n\"reasoning\": \"The conversation is in the initial stages of the Exploring phase with only 2 turns. The therapist has started to build rapport and understand the client's story, but more exploration is needed to fully capture the client's thoughts and relevant context.\",\n\"determination\": \"continue\"\n}\n```",
      "phase": "exploring"
    },
    {
      "index": 4,
      "role": "therapist",
      "statement": "That's completely understandable, and it's great that you're reaching out for support. It can be really helpful to start by identifying specific challenges you anticipate facing in your master's program, and then we can work together to develop strategies for addressing them. Would you like to talk a bit more about what's been on your mind lately, or is there a particular aspect of managing your ADHD that you'd like to explore first?",
      "phase": "exploring"
    },
    {
      "index": 5,
      "role": "client",
      "statement": "Hey, I’m glad to have someone to talk this through with. I guess I’m most worried about staying focused and keeping up with deadlines since my mind just jumps everywhere, so maybe we can start there?",
      "phase": "exploring"
    },
    {
      "index": "ac",
      "role": "sc_master",
      "statement": "```json\n{\n\"reasoning\": \"The conversation has reached three turns, and the client has started to share specific concerns and context. However, it hasn't yet fully explored the client's story or established mutually agreed goals. Further exploration is needed to deepen understanding and empathy.\",\n\"determination\": \"continue\"\n}\n```",
      "phase": "exploring"
    },
    {
      "index": 6,
      "role": "therapist",
      "statement": "It sounds like managing focus and deadlines is a big priority for you, and that makes sense given the demands of a master's program. Let's start by brainstorming some strategies that might help you stay on top of things and feel more in control. How do you usually handle deadlines and tasks when you're in the middle of a project?",
      "phase": "exploring"
    },
    {
      "index": 7,
      "role": "client",
      "statement": "Hey, honestly, I usually just wing it and end up scrambling at the last minute, which stresses me out big time. I try to make lists sometimes, but I either forget about them or get overwhelmed by how much is on there.",
      "phase": "exploring"
    },
    {
      "index": "ad",
      "role": "sc_master",
      "statement": "```json\n{\n\"reasoning\": \"The client has shared their main concern and context, and the therapist has demonstrated empathy and understanding. They've started exploring the client's specific challenges and some initial brainstorming. Goals of the Exploring phase have been met, allowing for transition to strengthen motivation and evoke Change Talk.\",\n\"determination\": \"move\"\n}\n```",
      "phase": "exploring"
    },
    {
      "index": 8,
      "role": "therapist",
      "statement": "It sounds like you've been managing deadlines in a way that's causing more stress than relief. I'm curious, what do you think might happen if you had a system that helped you stay on track and avoid those last-minute scrambles?",
      "phase": "guiding"
    },
    {
      "index": 9,
      "role": "client",
      "statement": "Hey, I think having a system could really help, like it might take some of that panic away if I could just see what’s coming up without freaking out. I’m just not sure what would actually work for me since nothing’s really stuck before, ya know?",
      "phase": "guiding"
    },
    {
      "index": "ae",
      "role": "sc_master",
      "statement": "```json\n{\n\"reasoning\": \"The conversation is in the initial stages of the Guiding phase, with just one turn focused on exploring strategies for managing ADHD in an academic setting. More exploration and evocation of Change Talk are needed before advancing.\",\n\"determination\": \"continue\"\n}\n```",
      "phase": "guiding"
    },
    {
      "index": 10,
      "role": "therapist",
      "statement": "That’s understandable, and it’s good to recognize that you’re open to trying new approaches. Perhaps we can explore a few options together that might fit better with your unique needs and preferences, and then see which ones you feel most comfortable giving a try.",
      "phase": "guiding"
    },
    {
      "index": 11,
      "role": "client",
      "statement": "Hey, yeah, I’m totally down to explore some new ideas with you. I just wanna find something that doesn’t feel like a huge chore or gets me all tangled up, ya know?",
      "phase": "guiding"
    },
    {
      "index": "af",
      "role": "sc_master",
      "statement": "```json\n{\n\"reasoning\": \"The conversation is in the Guiding phase with only two turns, focusing on exploring the client's concerns and brainstorming strategies. More exploration is needed to evoke Change Talk and identify specific change goals before moving to action planning.\",\n\"determination\": \"continue\"\n}\n```",
      "phase": "guiding"
    },
    {
      "index": 12,
      "role": "therapist",
      "statement": "That makes sense, and it’s great that you’re open to finding something that works with your style. Let’s start by exploring a few different strategies together and see which ones feel like they could fit into your routine without adding extra stress. Maybe we can find something that even feels kind of satisfying to use, like a tool that helps you feel more in control instead of overwhelmed.",
      "phase": "guiding"
    },
    {
      "index": 13,
      "role": "client",
      "statement": "Hey, that sounds awesome, I’m really into the idea of finding something that feels good to use and doesn’t stress me out more. Can we maybe start with something super simple, just to get the ball rolling, ya know?",
      "phase": "guiding"
    },
    {
      "index": "ag",
      "role": "sc_master",
      "statement": "```json\n{\n\"reasoning\": \"The conversation is in the guiding phase with only three turns completed. The client has expressed openness to exploring new strategies, but no specific change goals or next steps have been firmly established yet.\",\n\"determination\": \"continue\"\n}\n```",
      "phase": "guiding"
    },
    {
      "index": 14,
      "role": "therapist",
      "statement": "Sure, let's start with something simple that you can easily incorporate into your routine. How about we begin with a visual calendar or planner that allows you to see upcoming deadlines at a glance, so you can plan ahead without feeling overwhelmed?",
      "phase": "guiding"
    },
    {
      "index": 15,
      "role": "client",
      "statement": "Hey, yeah, a visual calendar sounds like it could be a good starting point, something I can just look at and not feel buried under. I’m down to try that out and see if it helps me keep track without overthinking it, ya know?",
      "phase": "guiding"
    },
    {
      "index": "ah",
      "role": "sc_master",
      "statement": "```json\n{\n\"reasoning\": \"The client has expressed openness to change and identified a specific goal: using a visual planner to manage deadlines. Change talk is present, and there is a clear next step to try the visual calendar. With four turns in the current phase and the client's willingness to explore and implement strategies, they are ready to move to the Choosing phase.\",\n\"determination\": \"move\"\n}\n```",
      "phase": "guiding"
    },
    {
      "index": 16,
      "role": "therapist",
      "statement": "Let's focus on that visual calendar idea then. We can start by creating a simple version together, maybe just a weekly view at first, to see how it feels. You could even try using a big whiteboard or a digital app, whichever seems less stressful for you. How does that sound?",
      "phase": "choosing"
    },
    {
      "index": 17,
      "role": "client",
      "statement": "Hey, that sounds pretty cool, I’m definitely up for trying a simple weekly view to start with. I think a whiteboard might be less stressful for me since I can just erase and adjust stuff without it feeling permanent, ya know?",
      "phase": "choosing"
    },
    {
      "index": "ai",
      "role": "sc_master",
      "statement": "```json\n{\n\"reasoning\": \"The client has agreed to try a visual calendar as a strategy to manage ADHD challenges in their master's program, reflecting commitment and readiness to take steps. The therapist and client have also discussed potential barriers and strategies. However, the current phase has only 1 turn, indicating the need for more discussion to solidify plans and monitor the client's progress.\",\n\"determination\": \"continue\"\n}\n```",
      "phase": "choosing"
    },
    {
      "index": 18,
      "role": "therapist",
      "statement": "That’s a great choice! Using a whiteboard gives you flexibility to make changes as needed. Let's think about what steps you'd take to set it up. Maybe you could start by mapping out your week, including important tasks and deadlines, and then adjust as you go?",
      "phase": "choosing"
    },
    {
      "index": 19,
      "role": "client",
      "statement": "Hey, yeah, I’m totally into the idea of mapping out my week on a whiteboard with the key stuff like tasks and deadlines. I think starting with just the big things and tweaking it as I go could keep it from feeling too heavy, ya know?",
      "phase": "choosing"
    },
    {
      "index": "aj",
      "role": "sc_master",
      "statement": "```json\n{\n\"reasoning\": \"The client and therapist have collaboratively developed a concrete action plan using a visual calendar to manage tasks and deadlines. Barriers such as feeling overwhelmed have been discussed, and the client has committed to trying the whiteboard method. The client expresses confidence and readiness to implement this plan. With only 2 turns in the Choosing phase, it's best to continue ensuring the plan is implemented and adjusted as needed.\",\n\"determination\": \"continue\"\n}\n```",
      "phase": "choosing"
    },
    {
      "index": 20,
      "role": "therapist",
      "statement": "That’s awesome to hear! Let's also consider how you might handle unexpected tasks or changes that pop up during the week. Perhaps you could reserve a section of the whiteboard for flexible or pending tasks, allowing you to easily move or adjust them as needed.",
      "phase": "choosing"
    },
    {
      "index": 21,
      "role": "client",
      "statement": "Hey, I like the idea of having a section for flexible stuff or unexpected tasks on the whiteboard. It’d probably help me not freak out when things change last minute, ya know?",
      "phase": "choosing"
    },
    {
      "index": "ak",
      "role": "sc_master",
      "statement": "```json\n{\n\"reasoning\": \"The client has agreed to a concrete action plan using a visual calendar and whiteboard. They have also discussed handling unexpected tasks, showing readiness through commitment and confidence in the strategy. They are taking steps to address barriers, indicating readiness for change.\",\n\"determination\": \"move\"\n}\n```",
      "phase": "choosing"
    },
    {
      "index": 22,
      "role": "therapist",
      "statement": "To summarize, we've explored ways to help you manage your ADHD while starting your master's program, focusing on visual planning as a strategy to reduce stress. We've decided to create a simple weekly calendar on a whiteboard, mapping out key tasks, deadlines, and a flexible section for unexpected changes. This approach should help you stay organized and adaptable to any adjustments needed throughout the week. Remember, the goal is to start small and be gentle with yourself as you find what works best for you. For our next session, I encourage you to reflect on how using the whiteboard planner feels and share any insights or challenges you encounter. Keep in mind that this is a process, and it's okay to make adjustments along the way. You've got this, and I'm here to support you every step of the way.",
      "phase": "terminating"
    },
    {
      "index": 23,
      "role": "client",
      "statement": "Hey, thanks for summing everything up and for the encouragement—it really helps to know I’ve got support. I’ll definitely think about how the whiteboard thing goes and let you know next time.",
      "phase": "terminating"
    },
    {
      "index": "al",
      "role": "sc_master",
      "statement": "```json\n{\n\"reasoning\": \"The session has naturally reached a point of closure with a summary of strategies discussed and a next-step plan for using a whiteboard planner. The client is encouraged to reflect on this strategy for the next session.\",\n\"determination\": \"stop\"\n}\n```",
      "phase": "terminating"
    }
  ],
  "dialogue_conv": "therapist: Welcome to our session today! I'm here to listen and support you in any way I can. Feel free to share whatever's on your mind, and we'll take it from there.\nclient: Hey, thanks for having me. I’m just really stressed about starting my master’s program this fall with my unmedicated ADHD, and I’m kinda lost on how to handle it academically.\ntherapist: That sounds like a lot to juggle, and it’s understandable that you’re feeling stressed. It’s important to remember that you’re not alone in this, and there are resources and strategies available to help you succeed in your master’s program while managing your ADHD. Have you had a chance to explore any of these options yet, or would you like to brainstorm some ideas together?\nclient: Hey, I haven’t really explored much yet, to be honest. I’m just kinda overwhelmed and not sure where to even start with managing this on my own.\ntherapist: That's completely understandable, and it's great that you're reaching out for support. It can be really helpful to start by identifying specific challenges you anticipate facing in your master's program, and then we can work together to develop strategies for addressing them. Would you like to talk a bit more about what's been on your mind lately, or is there a particular aspect of managing your ADHD that you'd like to explore first?\nclient: Hey, I’m glad to have someone to talk this through with. I guess I’m most worried about staying focused and keeping up with deadlines since my mind just jumps everywhere, so maybe we can start there?\ntherapist: It sounds like managing focus and deadlines is a big priority for you, and that makes sense given the demands of a master's program. Let's start by brainstorming some strategies that might help you stay on top of things and feel more in control. How do you usually handle deadlines and tasks when you're in the middle of a project?\nclient: Hey, honestly, I usually just wing it and end up scrambling at the last minute, which stresses me out big time. I try to make lists sometimes, but I either forget about them or get overwhelmed by how much is on there.\ntherapist: It sounds like you've been managing deadlines in a way that's causing more stress than relief. I'm curious, what do you think might happen if you had a system that helped you stay on track and avoid those last-minute scrambles?\nclient: Hey, I think having a system could really help, like it might take some of that panic away if I could just see what’s coming up without freaking out. I’m just not sure what would actually work for me since nothing’s really stuck before, ya know?\ntherapist: That’s understandable, and it’s good to recognize that you’re open to trying new approaches. Perhaps we can explore a few options together that might fit better with your unique needs and preferences, and then see which ones you feel most comfortable giving a try.\nclient: Hey, yeah, I’m totally down to explore some new ideas with you. I just wanna find something that doesn’t feel like a huge chore or gets me all tangled up, ya know?\ntherapist: That makes sense, and it’s great that you’re open to finding something that works with your style. Let’s start by exploring a few different strategies together and see which ones feel like they could fit into your routine without adding extra stress. Maybe we can find something that even feels kind of satisfying to use, like a tool that helps you feel more in control instead of overwhelmed.\nclient: Hey, that sounds awesome, I’m really into the idea of finding something that feels good to use and doesn’t stress me out more. Can we maybe start with something super simple, just to get the ball rolling, ya know?\ntherapist: Sure, let's start with something simple that you can easily incorporate into your routine. How about we begin with a visual calendar or planner that allows you to see upcoming deadlines at a glance, so you can plan ahead without feeling overwhelmed?\nclient: Hey, yeah, a visual calendar sounds like it could be a good starting point, something I can just look at and not feel buried under. I’m down to try that out and see if it helps me keep track without overthinking it, ya know?\ntherapist: Let's focus on that visual calendar idea then. We can start by creating a simple version together, maybe just a weekly view at first, to see how it feels. You could even try using a big whiteboard or a digital app, whichever seems less stressful for you. How does that sound?\nclient: Hey, that sounds pretty cool, I’m definitely up for trying a simple weekly view to start with. I think a whiteboard might be less stressful for me since I can just erase and adjust stuff without it feeling permanent, ya know?\ntherapist: That’s a great choice! Using a whiteboard gives you flexibility to make changes as needed. Let's think about what steps you'd take to set it up. Maybe you could start by mapping out your week, including important tasks and deadlines, and then adjust as you go?\nclient: Hey, yeah, I’m totally into the idea of mapping out my week on a whiteboard with the key stuff like tasks and deadlines. I think starting with just the big things and tweaking it as I go could keep it from feeling too heavy, ya know?\ntherapist: That’s awesome to hear! Let's also consider how you might handle unexpected tasks or changes that pop up during the week. Perhaps you could reserve a section of the whiteboard for flexible or pending tasks, allowing you to easily move or adjust them as needed.\nclient: Hey, I like the idea of having a section for flexible stuff or unexpected tasks on the whiteboard. It’d probably help me not freak out when things change last minute, ya know?\ntherapist: To summarize, we've explored ways to help you manage your ADHD while starting your master's program, focusing on visual planning as a strategy to reduce stress. We've decided to create a simple weekly calendar on a whiteboard, mapping out key tasks, deadlines, and a flexible section for unexpected changes. This approach should help you stay organized and adaptable to any adjustments needed throughout the week. Remember, the goal is to start small and be gentle with yourself as you find what works best for you. For our next session, I encourage you to reflect on how using the whiteboard planner feels and share any insights or challenges you encounter. Keep in mind that this is a process, and it's okay to make adjustments along the way. You've got this, and I'm here to support you every step of the way.\nclient: Hey, thanks for summing everything up and for the encouragement—it really helps to know I’ve got support. I’ll definitely think about how the whiteboard thing goes and let you know next time.",
  "completed": true
}